order,book,description,title
"0001","Genesis","The book of Genesis is a book of beginnings - the beginning of the world, of the human race, of a man of faith and a family of faith.  It can easily be divided into the lives of the principal characters of the book:
Adam - Genesis 1-5
Noah - Genesis 6-11
Abraham - Genesis 12-25
Isaac - Genesis 26
Jacob - Genesis 27-36
Joseph - Genesis 37-50
Genesis is above all the beginning of God's self-revelation.  God reveals both his power and character through his names.  It is also the beginning of the revelation of God's plan of salvation for a lost human race.
Listen now!","Genesis"
"0002","Exodus","The name ""Exodus"" is a Latin word taken from the Greek ""Exodos"", which was the name the translators gave the book when they translated the Hebrew version into the Greek Old Testament known as the Septuagint (LXX).  This name was retained by the Latin Vulgate and found its way into the English as well.  The word means ""departure"" and refers to the main event of the book, if not the Old Testament, namely the deliverance of the Hebrews from Egyptian bondage.  The first five books of the Bible are known as the Pentateuch, namely Genesis, Exodus, Leviticus, Numbers and Deuteronomy.  They are also commonly called ""the five books of Moses"".
The key people in Exodus are the Hebrews, the descendants of Abraham, Isaac and Jacob, who had now spent over 400 years in Egypt.  The key person is Moses, who is commonly held to be the author of the Pentateuch.
Moses' life can easily be divided into three time periods - all contained in the book of Exodus:
Moses' birth and life in Egypt 40 years  Exodus 1 - 4a
Moses' life in the Sinai Desert 40 years  Exodus 4b - 12
Moses' leadership of Israel    40 years  Exodus 13 - 40
Obviously, the majority of the book is covered by chapters 13 - 40.  These chapters include a time period of ca. 40 years.  But, most of the activity of chapters 13 - 40 covers only about two years.  The other 38 years were spent in the wilderness wanderings.  Those wanderings are covered mainly in the book of Numbers.
The book of Leviticus is a manual, covering the offerings of the Tabernacle worship, the priests and other laws.
Deuteronomy is a recap of the books of the Pentateuch exclusive of Genesis. It also records the passing of Moses.
Listen now!
","Exodus"
"0004","Numbers","The book of Numbers comes from the Septuagint (LXX) and is named for the census lists found in chapters 1 and 26.  The Hebrew title of this book is ""bemidbar"" and means ""in the desert"", which covers the content of the book more accurately.  This is the record of the ca. 40 year wilderness wanderings of Israel before they entered the Promised Land.
Listen now!","Numbers"
"0006","Joshua","Joshua is a record of the conquest of the Promised Land.  After some 400 years of bondage in Egypt and now 40 years in the wilderness, Joshua and the people entered the land promised to Abraham, Isaac and Jacob.  They first had to overcome the kings of Canaan before they could distribute the land to the 12 tribes of Israel.
Listen Now!","Joshua"
"0007","Judges","Judges tells of the leaders of Israel between Joshua and the beginning of the monarchy, a period of three to four hundred years.  There is a recurring cycle at this time in the life of Israel: sin, domination by a foreign power, repentance on the part of Israel, and finally, God raises up a judge who delivers Israel from foreign domination.  A time of peace and prosperity followed before the cycle was repeated all over again - apostasy, oppression, repentance, deliverance. It happened at least seven times.
There were at least 14 judges, with six major judges:  Othniel, Ehud, Deborah, Gideon, Jephthah and Samson.
This period in the life of Israel is characterized by unfaithfulness to God and general spiritual decline.  It is described in the last verse of the book: ""In those days Israel had no king; everyone did as he saw fit."" (Judges 21:25)
Listen Now!","Judges"
"0008","Ruth","Ruth is a short love story of four chapters.  It is a bright spot in the otherwise dark period of the Judges.  In the story, God brings together Ruth of Moab and Boaz of Israel.  Of great significance is the fact that Boaz and Ruth are in the genealogy of King David and of the Messiah, Jesus Christ (Matthew 1:5-6 and Luke3:32).  
Listen Now!","Ruth"
"0009","1st Samuel","First and Second Samuel are named after the man, Samuel, who transitioned Israel from the rule of the judges to the monarchy.  Samuel anointed both Saul and David as the first two successive kings of Israel.
First Samuel can be outlined in this manner:
Samuel's birth, youth and calling     1 Samuel 1-7
The establishment of the kingship   1 Samuel 8-12
The failure of Saul's kingship      1 Samuel 13-15
David's rise to power        1 Samuel 16-31
The lessons below concern themselves primarily with the life of David before he became king.
Listen Now!","1st Samuel"
"0010","2nd Samuel","Second Samuel is all about David's kingship and family.  He ruled seven years over Judah and thirty-three years over the United Kingdom of the south (Judah) and the north (Israel) for a total of 40 years.  During this reign there were highs and lows.  But through it all David showed, that in spite of his imperfections, he had a heart for God.
Second Samuel can be outlined in the following manner:
David becomes king over Judah        2 Samuel 1-4
David becomes king over all Israel      2 Samuel 5:1-5
David conquers Jerusalem      2 Samuel 5:6-25
David brings the Ark to Jerusalem      2 Samuel 6
David is promised an everlasting kingdom    2 Samuel 7
David's kingdom is geographically extended   2 Samuel 8
David faithful to his agreement with Jonathan   2 Samuel 9
David commits adultery and murder     2 Samuel 10-12
David's sons Amnon and Absalom are lost    2 Samuel 13-20
David's reign is considered        2 Samuel 21-24
The lessons below concern themselves with the life of David as king.
Listen Now!","2nd Samuel"
"0011","1st Kings","The book of First Kings covers the very end of the Davidic reign, the reign of his son Solomon over the United Kingdom, the building of the Temple, and after Solomon's death, the division of the kingdom into two parts - Israel in the north and Judah in the south.  
In the Hebrew Old Testament the books of First and Second Kings are one book.  The Septuagint (LXX, the Greek translation of the Old Testament) translators of the Hebrew Old Testament divided the book.
Because of sin, namely idolatry, both kingdoms were eventually carried away into captivity - first the northern Kingdom of Israel (by the Assyria in 722 B.C.) and second the southern Kingdom of Judah by Babylonia in 586 B.C.  
But God did not punish his people quickly.  In much patience and mercy he sent prophets to both kingdoms in an attempt to get the kings and the people to repent.  All the kings of the northern kingdom were evil.  Some of the kings of the southern kingdom were good but many were bad.  In the end, God had to punish both the north and the south.
First Kings records the ministry of the great prophet Elijah to the northern kingdom of Israel.  The four lessons below report on this ministry.
Listen Now!
","1st Kings"
"0012","2nd Kings","The book of Second Kings covers the last 130 years of the Northern Kingdom of Israel and the last 250 years of the Southern Kingdom of Judah.  It records the translation of the prophet Elijah into heaven in a fiery chariot and the subsequent ministry of his successor, Elisha.  The prophet Elisha ministered to Israel, Judah and even to foreign countries.
""The LORD warned Israel and Judah through all his prophets and seers: 'Turn from your evil ways.  Observe my commands and decrees, in accordance with the entire Law that I commanded your fathers to obey and that I delivered to you through my servants the prophets.' But they would not listen…they rejected his decrees and the covenant he had made with their fathers and the warnings he had given them.  They followed worthless idols and themselves became worthless."" (2Kings 17:13-15).  And so God gave them over to captivity by the world powers at the time.
The captivity of Israel by the Assyrian Empire in 722 B.C. is noted (17:23).  The captivity of Judah by the Babylonian Empire in 586 B.C. is also described with the destruction of Jerusalem, her walls and the Temple (25:21).
Second Kings records the end of Elijah's ministry and the ministry of the great prophet Elisha.  The record of Elisha's death (from natural causes) is found in 2Kings 13:20.
The seven lessons below report Elisha's ministries.
Listen Now!
","2nd Kings"
"0015","Nehemiah","The Old Testament books of Ezra and Nehemiah go together.  They tell the story of Israel's return to the Land of Promise from the exile in Babylon.
These books represent two periods in Israel's restoration to the land at the end of the exile: first, the rebuilding of the temple and the re-establishment of Israel's spiritual life (538-516 B.C./Ezra 1-10); then the rebuilding of the wall around Jerusalem (458-420 B.C./Nehemiah 1-13).  Ezra, the priest, returned first (see the book of Ezra), followed later by Nehemiah, a high ranking official in the service of Artaxerxes, King of Babylon.
Nehemiah is an exciting book that tells of the faithfulness of ""Yahweh"" (The LORD), the Elohim (God) of Israel.  It also records the obedience of a layman, Nehemiah, in the service of the purposes of God.  Without question, God is sovereign over Israel and the nations of this world.  
Listen Now!
","Nehemiah"
"0021","Esther","The book of Esther is unique in the Old Testament in that it does not once mention the names of God (Yahweh or Elohim).  And yet it is highly esteemed among the Jewish people.
The events of the book transpire during the reign of King Xerxes of Persia (present day Iran).  The issue was the survival of the Jewish people in Persia.  The providence of God is overall evident as a Jewish young woman, Esther, finds herself in a position to save the Jews of Persia from genocide.
Listen now!
","Esther"
"0023","Psalms","The writers of the psalms express a wide range of feelings and experiences, from depression to joy. These experiences are based on particular circumstances in the days of the Psalmist, yet they are applicable to our daily lives today in the 21st century. The modern age is not unique--we feel the same emotions and are often confounded by the same kinds of issues and problems in life.  Whether we cry out in need, or extend worship, it is to the same God today as in the days of the Psalmist.  
The Psalms are a collection of Old Testament hymns grouped according to common themes, common purpose, or a common author. It is difficult for scholars to precisely date individual psalms, or to discover just how and when they were collected and compiled.  We do know that Moses wrote one.  Probably David is the most popular writer of the Psalms.  The process continued into the days after the Hebrew exile. According to early manuscripts of the Psalms found at Qumran in Israel, it is believed that the whole collection of Psalms as we have them today must have been finalized sometime before the Maccabean period around the second century before Christ.
The late C.S. Lewis, noted author and scholar, commented on the Psalms as follows: ""The Psalms are poems, and poems intended to be sung: not doctrinal treatises, nor even sermons ...They must be read as poems if they are to be understood ...otherwise we shall miss what is in them and think we see what is not.""
Of the 150 Psalms written, Pastor Art teaches from 30 and delivers pertinent and heartfelt messages that make it not only easy to identify with the Psalmists of old, but also to apply the principles of these scriptural hymns to living in the modern age.","The Psalms"
"0024","Isaiah","The book of Isaiah has been called by some ""The Fifth Gospel"" because it has so much to say about the Messiah.  The New Testament identifies Jesus as the Messiah that Isaiah foretold.
The book, written most likely by one author, seems to divide into two parts:  chapters 1-39 (the failure of humankind) and chapters 40-66 (the hope of the Messiah).  Of all the books of the Old Testament, Isaiah is the most quoted in the New Testament.
In the eighth century B.C. Elijah and Elisha were the most prominent non-writing prophets.  Isaiah, a writing prophet, began the eight century B.C. followed by many others.  There are five Major Prophets (those who wrote longer books) and 12 Minor Prophets (those who wrote shorter books).  All the prophets are important regardless of the length of their books.  They wrote mainly to the divided kingdom, Israel in the north and Judah in the south, prior to their going into captivity (Israel to Assyria in 722 B.C and Judah to Babylon in 586 B.C.)  Some of the later prophets wrote to the Jews returning to Jerusalem after the captivity.
The lessons below cover a portion of Isaiah's message. 
Listen Now!","Isaiah"
"0025","Ezekiel","The writer of this book is Ezekiel, the prophet-priest of the Babylonian exile.  He was exiled along with 10,000 Jews from Judea to Babylon by King Nebuchadnezzar in 597 B.C.  In 586 B.C. there was a final siege on Jerusalem by the Babylonians, at which time the city and the Temple were burned.
Ezekiel wrote this prophesy from Babylonia, preceding the destruction of Jerusalem by 7 years and following it by 15 years.  These 22 years of his prophetic activity exceeded a priest's normal service by two years.  (Priests served from age 30 to age 50, after which they entered semi-retirement and assisted others in ministry.)
The book of Ezekiel can be outlined in the following way:
Jerusalem and the Temple will fall - Chapters.1 to 24  
Seven surrounding nations will be judged - Chapters. 25 to 32   
A word of hope given for God's people -  Chapters. 33 to 48  
The prophecy of Ezekiel proclaims God's sovereignty over creation, people, nations and the course of history. 
Listen Now!","Ezekiel"
"0026","Daniel","Daniel was a prophet of the late Babylonian exile period.  The book is of the apocalyptic genre' in the same class as Ezekiel, Zechariah and Revelation.  The period is during that of the successive world powers of Babylonia, the Medes and the Persians and Persia. The inspired author of the book is not known.  However, it may well have been the prophet, Daniel, himself.  
Half of the book, chapters 1-6, is about the Israelite and government official, Daniel, and his friends.  It shows them faithfully serving the one true God-Yahweh, the God (Elohim) of Israel.  They were faithful to God at the risk of their lives.
The second half of the book, chapters 7-12, gives us the dreams/visions of the Prophet Daniel.  These dreams/visions range from easy to understand to very difficult, if not impossible, to understand.  One thing is clear.  God Almighty is in ultimate control of human history from the time of Daniel to the end times and the final establishment of the Kingdom of God.    
Listen Now!","Daniel"
"0027","Hosea","There are 12 Minor Prophets in the Old Testament: Hosea, Joel, Amos, Obadiah, Jonah, Micah, Nahum, Habakkuk, Zephaniah, Haggai, Zechariah and Malachi.  The five Major Prophets are Isaiah, Jeremiah, Lamentations, Ezekiel and Daniel.  The ""major"" and ""minor"" designations have nothing to do with the importance of the prophecy.  All the prophets, major and minor, are important.  These designations have to do with the length of the prophecy or book.  The Major Prophets are longer and the Minor Prophets are shorter in length.
Of these 12 Minor Prophets, the first nine are pre-exilic (preceding the Assyrian exile in 722 B.C. and/or Babylonian exile in 586 B.C.) and three are post-exilic (during the time of the Jewish return from Babylon to Jerusalem).
Rarely will you ever hear a sermon series on the Minor Prophets or even a Sunday School course of lessons.  This is a shame as the Minor Prophets have much to tell us about humankind and especially about God Almighty.  Here, gathered in 12 lessons, one on each Minor Prophet, you will learn the thrust of each book.  May it motivate you to read and study the Minor Prophets in greater detail.  You will greatly benefit, if you will do so.    
Listen Now!","Hosea"
"0028","Joel","There are 12 Minor Prophets in the Old Testament: Hosea, Joel, Amos, Obadiah, Jonah, Micah, Nahum, Habakkuk, Zephaniah, Haggai, Zechariah and Malachi.  The five Major Prophets are Isaiah, Jeremiah, Lamentations, Ezekiel and Daniel.  The ""major"" and ""minor"" designations have nothing to do with the importance of the prophecy.  All the prophets, major and minor, are important.  These designations have to do with the length of the prophecy or book.  The Major Prophets are longer and the Minor Prophets are shorter in length.
Of these 12 Minor Prophets, the first nine are pre-exilic (preceding the Assyrian exile in 722 B.C. and/or Babylonian exile in 586 B.C.) and three are post-exilic (during the time of the Jewish return from Babylon to Jerusalem).
Rarely will you ever hear a sermon series on the Minor Prophets or even a Sunday School course of lessons.  This is a shame as the Minor Prophets have much to tell us about humankind and especially about God Almighty.  Here, gathered in 12 lessons, one on each Minor Prophet, you will learn the thrust of each book.  May it motivate you to read and study the Minor Prophets in greater detail.  You will greatly benefit, if you will do so.    
Listen Now!
","Joel"
"0029","Amos","There are 12 Minor Prophets in the Old Testament: Hosea, Joel, Amos, Obadiah, Jonah, Micah, Nahum, Habakkuk, Zephaniah, Haggai, Zechariah and Malachi.  The five Major Prophets are Isaiah, Jeremiah, Lamentations, Ezekiel and Daniel.  The ""major"" and ""minor"" designations have nothing to do with the importance of the prophecy.  All the prophets, major and minor, are important.  These designations have to do with the length of the prophecy or book.  The Major Prophets are longer and the Minor Prophets are shorter in length.
Of these 12 Minor Prophets, the first nine are pre-exilic (preceding the Assyrian exile in 722 B.C. and/or Babylonian exile in 586 B.C.) and three are post-exilic (during the time of the Jewish return from Babylon to Jerusalem).
Rarely will you ever hear a sermon series on the Minor Prophets or even a Sunday School course of lessons.  This is a shame as the Minor Prophets have much to tell us about humankind and especially about God Almighty.  Here, gathered in 12 lessons, one on each Minor Prophet, you will learn the thrust of each book.  May it motivate you to read and study the Minor Prophets in greater detail.  You will greatly benefit, if you will do so.    
Listen Now!","Amos"
"0030","Obadiah","There are 12 Minor Prophets in the Old Testament: Hosea, Joel, Amos, Obadiah, Jonah, Micah, Nahum, Habakkuk, Zephaniah, Haggai, Zechariah and Malachi.  The five Major Prophets are Isaiah, Jeremiah, Lamentations, Ezekiel and Daniel.  The ""major"" and ""minor"" designations have nothing to do with the importance of the prophecy.  All the prophets, major and minor, are important.  These designations have to do with the length of the prophecy or book.  The Major Prophets are longer and the Minor Prophets are shorter in length.
Of these 12 Minor Prophets, the first nine are pre-exilic (preceding the Assyrian exile in 722 B.C. and/or Babylonian exile in 586 B.C.) and three are post-exilic (during the time of the Jewish return from Babylon to Jerusalem).
Rarely will you ever hear a sermon series on the Minor Prophets or even a Sunday School course of lessons.  This is a shame as the Minor Prophets have much to tell us about humankind and especially about God Almighty.  Here, gathered in 12 lessons, one on each Minor Prophet, you will learn the thrust of each book.  May it motivate you to read and study the Minor Prophets in greater detail.  You will greatly benefit, if you will do so.    
Listen Now!","Obadiah"
"0031","Jonah","There are 12 Minor Prophets in the Old Testament: Hosea, Joel, Amos, Obadiah, Jonah, Micah, Nahum, Habakkuk, Zephaniah, Haggai, Zechariah and Malachi.  The five Major Prophets are Isaiah, Jeremiah, Lamentations, Ezekiel and Daniel.  The ""major"" and ""minor"" designations have nothing to do with the importance of the prophecy.  All the prophets, major and minor, are important.  These designations have to do with the length of the prophecy or book.  The Major Prophets are longer and the Minor Prophets are shorter in length.
Of these 12 Minor Prophets, the first nine are pre-exilic (preceding the Assyrian exile in 722 B.C. and/or Babylonian exile in 586 B.C.) and three are post-exilic (during the time of the Jewish return from Babylon to Jerusalem).
Rarely will you ever hear a sermon series on the Minor Prophets or even a Sunday School course of lessons.  This is a shame as the Minor Prophets have much to tell us about humankind and especially about God Almighty.  Here, gathered in 12 lessons, one on each Minor Prophet, you will learn the thrust of each book.  May it motivate you to read and study the Minor Prophets in greater detail.  You will greatly benefit, if you will do so.    
Listen Now!","Jonah"
"0032","Micah","There are 12 Minor Prophets in the Old Testament: Hosea, Joel, Amos, Obadiah, Jonah, Micah, Nahum, Habakkuk, Zephaniah, Haggai, Zechariah and Malachi.  The five Major Prophets are Isaiah, Jeremiah, Lamentations, Ezekiel and Daniel.  The ""major"" and ""minor"" designations have nothing to do with the importance of the prophecy.  All the prophets, major and minor, are important.  These designations have to do with the length of the prophecy or book.  The Major Prophets are longer and the Minor Prophets are shorter in length.
Of these 12 Minor Prophets, the first nine are pre-exilic (preceding the Assyrian exile in 722 B.C. and/or Babylonian exile in 586 B.C.) and three are post-exilic (during the time of the Jewish return from Babylon to Jerusalem).
Rarely will you ever hear a sermon series on the Minor Prophets or even a Sunday School course of lessons.  This is a shame as the Minor Prophets have much to tell us about humankind and especially about God Almighty.  Here, gathered in 12 lessons, one on each Minor Prophet, you will learn the thrust of each book.  May it motivate you to read and study the Minor Prophets in greater detail.  You will greatly benefit, if you will do so.    
Listen Now!","Micah"
"0032","Nahum","There are 12 Minor Prophets in the Old Testament: Hosea, Joel, Amos, Obadiah, Jonah, Micah, Nahum, Habakkuk, Zephaniah, Haggai, Zechariah and Malachi.  The five Major Prophets are Isaiah, Jeremiah, Lamentations, Ezekiel and Daniel.  The ""major"" and ""minor"" designations have nothing to do with the importance of the prophecy.  All the prophets, major and minor, are important.  These designations have to do with the length of the prophecy or book.  The Major Prophets are longer and the Minor Prophets are shorter in length.","Nahum"
"0033","Habakkuk","There are 12 Minor Prophets in the Old Testament: Hosea, Joel, Amos, Obadiah, Jonah, Micah, Nahum, Habakkuk, Zephaniah, Haggai, Zechariah and Malachi.  The five Major Prophets are Isaiah, Jeremiah, Lamentations, Ezekiel and Daniel.  The ""major"" and ""minor"" designations have nothing to do with the importance of the prophecy.  All the prophets, major and minor, are important.  These designations have to do with the length of the prophecy or book.  The Major Prophets are longer and the Minor Prophets are shorter in length.
Of these 12 Minor Prophets, the first nine are pre-exilic (preceding the Assyrian exile in 722 B.C. and/or Babylonian exile in 586 B.C.) and three are post-exilic (during the time of the Jewish return from Babylon to Jerusalem).
Rarely will you ever hear a sermon series on the Minor Prophets or even a Sunday School course of lessons.  This is a shame as the Minor Prophets have much to tell us about humankind and especially about God Almighty.  Here, gathered in 12 lessons, one on each Minor Prophet, you will learn the thrust of each book.  May it motivate you to read and study the Minor Prophets in greater detail.  You will greatly benefit, if you will do so.    
Listen Now!
","Habakkuk"
"0034","Zephaniah","There are 12 Minor Prophets in the Old Testament: Hosea, Joel, Amos, Obadiah, Jonah, Micah, Nahum, Habakkuk, Zephaniah, Haggai, Zechariah and Malachi.  The five Major Prophets are Isaiah, Jeremiah, Lamentations, Ezekiel and Daniel.  The ""major"" and ""minor"" designations have nothing to do with the importance of the prophecy.  All the prophets, major and minor, are important.  These designations have to do with the length of the prophecy or book.  The Major Prophets are longer and the Minor Prophets are shorter in length.
Of these 12 Minor Prophets, the first nine are pre-exilic (preceding the Assyrian exile in 722 B.C. and/or Babylonian exile in 586 B.C.) and three are post-exilic (during the time of the Jewish return from Babylon to Jerusalem).
Rarely will you ever hear a sermon series on the Minor Prophets or even a Sunday School course of lessons.  This is a shame as the Minor Prophets have much to tell us about humankind and especially about God Almighty.  Here, gathered in 12 lessons, one on each Minor Prophet, you will learn the thrust of each book.  May it motivate you to read and study the Minor Prophets in greater detail.  You will greatly benefit, if you will do so.    
Listen Now!
","Zephaniah"
