order,book,description,title
"0600","Colossians","The book of Colossians is one of four ""Prison Epistles"" (Ephesians, Philippians, Colossians and Philemon) written by the Apostle Paul about A.D. 60 - 61.  The village of Colosse was a Roman city in Asia Minor (modern Turkey) at the base of the 8,000 foot Mt. Cadmus in the Lycus River valley 100 miles east of Ephesus.  Actually, there were three small towns in this valley:  Colosse, Laodicaea and Hierapolis.  All three are mentioned in this letter.  Interestingly, Paul never personally visited this valley as far as we know (2:1).
The church at Colosse may have been started by Epaphras, one of Paul's close co-workers.  Epaphras was from Colosse (4:12) and cared deeply about this church.
This short letter has great sections on the deity of Jesus Christ (1:15,19), his active participation in the creation of the world (1:16) and the fullness of understanding in him (2:2).  Colossians is a great Christological book.  Also, rules for family life in Paul's times are found in the third chapter.  All-in-all, Colossians is rich in Christian doctrine and directions for practical Christian living.","The Book of Colossians"
"0650","1st Thessalonians","The Apostle Paul ministered in the city of Thessalonica (present day northern Greece) during his second missionary journey and following his ministry at Philippi.  The record of Paul's ministry in Thessalonica is found in Acts 17:1-10.  His ministry was in the Jewish synagogue.  The message was that Jesus is the Messiah, who had to suffer and rise from the dead.  Some Jewish and Gentiles were converted.  However, other Jews resisted and started a riot against Paul in the city.  False charges were leveled at Paul and his companions before the city officials.  This necessitated the exodus of Paul from Thessalonica.
The two Thessalonian letters, along with the Galatian letter, are probably the earliest that Paul wrote-around A.D. 51.  In addition to general instructions on survival in the midst of persecution and on godly living, Paul wrote them about the coming of Christ.  This is the only place in the New Testament where ""the rapture"" is indicated.  It is also the first apostolic writing on ""the coming"" or the ""parousia"" of Jesus.
First Thessalonians is truly a helpful letter for the Christian believer.","1st Thessalonians"
"0700","2nd Thessalonians","The second letter to the Thessalonians was written by Paul about the same time as the first letter - A.D. 51.  In it the apostle continues to thank God for these Christians and to assure them of his prayers.  
As he spoke about the coming of Christ, ""parousia"", which is ""the rapture"", in the first letter, here he speaks of the revealing of Christ, ""apokalupsis"", which is the second coming of Christ on ""the Day of the Lord"" as found in Revelation 19.  Paul taught the coming of the Lord to this young church.  In fact, nowhere else in the Pauline corpus are these teachings found.  They are truly unique to the Thessalonian correspondence.  Otherwise, general instruction on godly living is offered.","2nd Thessalonians"
"0780","1st Timothy","1st Timothy is one of three ""pastoral epistles"", namely 1st Timothy, 2nd Timothy and Titus.  These books were written by the missionary-evangelist, Paul, to his younger proteges, Timothy, who was pastoring the Ephesian church, and Titus, who was pastoring the church on the island of Crete.  This book was probably written about A.D 60.
Timothy was a younger man, whom Paul met during his second missionary journey.  Timothy joined the evangelistic team and traveled with Paul.  Later Paul sent him to Ephesus to pastor this promising church.
Paul instructs Timothy, his ""true son in the faith"", on certain basic issues of early church life.  In contrast to 2nd Timothy, this first letter is all about church order in the local assembly of believers.  It is relevant to churches in the 21st Century.","1st Timothy"
"0790","2nd Timothy","This letter was Paul's last.  He is once again a prisoner for Christ - this time facing death.  It is an intensely personal epistle written from the heart of the old warrior, Paul, to the younger minister, Timothy.  Paul opens his heart as he reflects on his own ministry and on that of Timothy.  It is a challenge that any minister or layperson can read with great profit.","2nd Timothy"
"0800","Titus","The Book of Titus is one of three ""pastoral letters"" in the New Testament: 
1 & 2 Timothy and Titus.  The writer identifies himself as Paul (Titus 1:1).  He writes to ""Titus, my true son"", (Titus 1:4).  The letter was most likely written soon after Paul's release from house arrest in Rome ca. A.D 62 or 63 (Acts 28).   
Paul sent Titus to the Island of Crete in the Mediterranean Sea located just below both present day Greece and Turkey to give spiritual direction to a troubled church.  There were false teachers in this church that needed to be dealt with.  As the mentor of Titus, Paul gave instructions both theological and practical to guide the leadership of Titus in this sensitive mission. Those instructions are valid for our times as well.","Titus"
"0850","Philemon","Philemon is a private letter written by the Apostle Paul from his Roman imprisonment to Philemon, one of his converts and a good friend who lived in Colossae, located in present-day Turkey.  A group of local Christians regularly met in Philemon's home as the Church in Colossae.  Philemon, being of some standing in the society of his time, had slaves.  One of them, Onesimus, had apparently stolen a significant amount of money and run away to Rome where he could easily escape detection.   It is there that Onesimus came into contact with the imprisoned Apostle Paul and became a Christian.  From the letter it is evident that the Apostle Paul not only loved and held Philemon in high regard, but he also loved the young slave Onesimus like a son.
After Onesimus' conversion the problem was that he remained Philemon's legal property. The crimes that Onesimus committed carried with them punishment. Although the Apostle Paul enjoyed Onesimus' company, he could not keep him there in Rome without Philemon's willing consent. So he wrote the letter of Philemon as a ""covering note"" for Onesimus and sent him back to Philemon to make amends.  Paul's intention in writing was to ask Philemon to be lenient with the run-away slave. The Apostle took care in explaining the conversion of Onesimus, who was returning to his master as a very different man. He was not just a slave now, but a brother-Christian and the Apostle wanted wanted Philemon to welcome him as such.
This letter is loving, tactful, considerate, and full of warm praise. Paul knows Philemon - his faith and Christian love.  From verses 15 and 16 it is not clear whether Paul has any thought of Onesimus being set free. Slavery was such an integral part of the social structure of the day - the ancient Roman empire had over 60 million slaves in those days - that to preach freedom would have been tantamount to revolution. Paul's brief was not to engage in political campaigning, but preach a gospel capable of transforming human life from within.
Bible scholars believe that the Apostle Paul's friend Tychicus accompanied Onesimus back to Philemon's household to keep him company during the journey and to provide moral support upon arriving back.  Tychicus also carried with him the letter to the Colossian Church bearing the latest news from the Apostle Paul (Colossians 4:7-9).  Pastor Art uses the short letter of Philemon as a model for change and transformation.  In his short message Pastor Art discusses how modern day Christians can affect change in an ungodly culture through the message of love.","The Book of Philemon"
"0900","Hebrews","The book of Hebrews has an unknown author.  Many in the past have thought that the Apostle Paul wrote it, or maybe Barnabas or Apollos.  In recent centuries, since the Reformation, most have concluded that we just do not know who wrote it.  Nevertheless, the Church, under the guidance of the Holy Spirit has accepted the canonicity and inspiration of Hebrews. 
It appears to have been written mainly to Hebrew or Jewish Christians, who under persecution were thinking of abandoning their Christian faith and reverting back to Judaism.  The writer exhorts them to hold fast to the truth of Jesus Christ and not to forsake their faith in him.
Hebrews was written prior to the fall of Jerusalem in A.D. 70, since this event is not referenced.
The theme of the book is the superiority of Jesus Christ.  He is superior to angels, to Moses, to the Aaronic priesthood, and to the Mosaic sacrifices.  Jesus is God's last word to humankind for salvation.  Strong warnings against the consequences of apostasy are given in both chapters 6 and 10.  Well known is the roll call of the heroes of faith in chapter 11.  These Old Testament saints are examples of faith for us to follow.
The book closes with practical exhortations to live out the Christian life in faith and practical service.","The Book of Hebrews"
"0950","James","The book of James is one of the seven general epistles (James to Jude in the New Testament).  It was written, it is believed, by James, the half-brother of Jesus, about A.D. 48 to A.D. 50 most likely in Jerusalem.  It was written to Jews, who had scattered around the Roman Empire (James 1:1).   
The book is very Jewish in character and was written early undoubtedly when the church was still mostly Jewish in membership.  It doesn't seem to reflect any of the issues one typically finds in the Pauline letters.       
  James became an early leader in the Jerusalem Church (Acts 15:13; ICor.15:7; Acts 21:18; Gal. 2:9, 12).  He played a key leadership role in the Council of Jerusalem and the decision to more clearly define what it means to be Christian.
  The writing itself contains five chapters.  It is profoundly practical, demanding not just faith-words but faith - actions to demonstrate the authenticity of one's personal faith in Jesus.  James wrote like a prophet of the Old Testament - telling it like it is.  He warns and exhorts.  Clearly, his desire is to have believers who are genuinely Christians and not just a lot of talk.","The Book of James"
"0960","1st Peter","Simon Peter wrote the book of 1st Peter from ""Babylon"" (the city of Babylon in Mesopotamia? a town in Egypt? or the figurative name for Rome?) around A.D. 60, before or after.  A wide range of subjects is covered, all of which are intended to strengthen the church in Northern Asia Minor in the face of a growing persecution.  This is not a formal academic lecture (such as Romans) but rather a pastor exhorting his congregation.  There is much in this letter that is relevant to Christians in the 21st Century.","1st Peter"
"0970","2nd Peter","2nd Peter was written probably by the Apostle Peter, perhaps from Rome around A.D. 65 to 67.  It was written shortly before his death apparently to the same churches he addressed in the first letter - namely the churches of Northern Asia Minor.  There is no reference to suffering; therefore the threat of persecution must have disappeared, at least for the moment.  There is much admonition to holy living, especially in the light of ""the Day of the Lord"".","2nd Peter"
"1000","1st John","The beloved books of 1st, 2nd, & 3rd John were written by the Apostle John, who was one of the original 12 disciples.  The authorship is not indicated in the text of the letters such as is found in the Pauline letters.  Nevertheless, external evidence for the authorship of these three epistles by John is strong and without significant controversy.
The Apostle John wrote five New Testament books:  the Gospel of John, 1st, 2nd, & 3rd John, and the book of Revelation.
John originally ministered in Jerusalem.  Early church tradition tells us that he left Jerusalem (probably well ahead of the destruction of the temple in A.D. 70) and went to the Roman province of Asia.  There he ministered in and around Ephesus and probably with all of the seven churches of Asia described in Revelation 2 and 3.
The date of writing was most likely about A.D. 95.  John, the aged father of the churches wrote to his beloved children.
The purpose of John's writings was to reassure these Christians, who were living in a difficult pagan environment, that they were indeed the children of God.  It was further an encouragement for these believers to love one another in true Christian fellowship.  There were also warnings about both internal and external threats of false teaching, insincere Christian living, and the difficulty of sin in the believer's life.","1st John"
"1050","2nd John","The beloved books of 1st, 2nd, & 3rd John were written by the Apostle John, who was one of the original 12 disciples.  The authorship is not indicated in the text of the letters such as is found in the Pauline letters.  Nevertheless, external evidence for the authorship of these three epistles by John is strong and without significant controversy.
The Apostle John wrote five New Testament books:  the Gospel of John, 1st, 2nd, & 3rd John, and the book of Revelation.
John originally ministered in Jerusalem.  Early church tradition tells us that he left Jerusalem (probably well ahead of the destruction of the temple in A.D. 70) and went to the Roman province of Asia.  There he ministered in and around Ephesus and probably with all of the seven churches of Asia described in Revelation 2 and 3.
The date of writing was most likely about A.D. 95.  John, the aged father of the churches wrote to his beloved children.
The purpose of John's writings was to reassure these Christians, who were living in a difficult pagan environment, that they were indeed the children of God.  It was further an encouragement for these believers to love one another in true Christian fellowship.  There were also warnings about both internal and external threats of false teaching, insincere Christian living, and the difficulty of sin in the believer's life.","2nd John"
"1100","3rd John","The beloved books of 1st, 2nd, & 3rd John were written by the Apostle John, who was one of the original 12 disciples.  The authorship is not indicated in the text of the letters such as is found in the Pauline letters.  Nevertheless, external evidence for the authorship of these three epistles by John is strong and without significant controversy.
The Apostle John wrote five New Testament books:  the Gospel of John, 1st, 2nd, & 3rd John, and the book of Revelation.
John originally ministered in Jerusalem.  Early church tradition tells us that he left Jerusalem (probably well ahead of the destruction of the temple in A.D. 70) and went to the Roman province of Asia.  There he ministered in and around Ephesus and probably with all of the seven churches of Asia described in Revelation 2 and 3.
The date of writing was most likely about A.D. 95.  John, the aged father of the churches wrote to his beloved children.
The purpose of John's writings was to reassure these Christians, who were living in a difficult pagan environment, that they were indeed the children of God.  It was further an encouragement for these believers to love one another in true Christian fellowship.  There were also warnings about both internal and external threats of false teaching, insincere Christian living, and the difficulty of sin in the believer's life.","3rd John"
"1150","Jude","The book of Jude was written, most likely by another half brother of Jesus (the other one being James).  It was written about A.D. 65.
It is a short, one chapter writing originally penned to extol God's salvation in Jesus Christ (1:3).  However, he found it necessary to change his plans and exhort and warn the church about false teachings that some were bringing into the church.  Jude doesn't spare any words as he warns the church to be careful of error.  He lays it on the line!
The chapter ends with a very positive benediction (1:24-25) bringing praise to God who is able to keep his people from falling.","The Book of Jude"
"1200","Revelation","The book of Revelation is the one prophetic book of the New Testament with 22 chapters.  It was written by the Apostle John, one of Jesus' disciples, who also wrote the Gospel of John and the three epistles of John - five New Testament books in all.  Revelation was written as John was in exile for his faith on the island of Patmos about A.D. 95.
The book divides itself into three principal parts.  First, an opening vision of Jesus and messages to the seven churches of the Roman province of Asia.  Second, there follows most of the book, which is a description of the seven years of tribulation that will come upon the earth: seven seals, seven trumpets, and seven bowls - the pressure God is bringing on the earth to secure repentance among the peoples.  It all draws to a close with the second coming of Jesus Christ - King of kings and Lord of lords (19:16).  Third, the book then ends with a brief description of the judgment and the new heavens and new earth.
This marvelous book was written to encourage the suffering saints, persecuted by the Roman Empire.  Evil will not win.  God will!  It has much encouragement for every subsequent generation, because the end of things has not yet come.  But it will.  We need to be prepared.","The Book of Revelation"
"1400","Special","Here you will find lessons that touch on special topics such as communion, people of faith, and special occasions such as Christmas and Easter.  Other such lessons continue to be added from time to time.","Special Topics and Occasions"
"1410","The Life of Jesus","The life of Jesus could be considered in a number of ways.  Pastor Art has elected to touch on the high-points of the Lord's earthly existence and to do so in 12 lessons.  This will take the listener from the eternity of Jesus through his earthly sojourn and back into his eternal state.  Above all you will see Jesus as the Second Person of the Holy Trinity and in that role as the redeemer of humankind.
A possible chronology of the life and ministry of Jesus is as follows:
Birth                 4 B.C.
Year of Inauguration 26-27 A.D.
Year of Popularity    27-28 A.D.
Year of Opposition    28-29 A.D.
Death and Resurrection          29 A.D.
Contemplate now the most magnificent life ever lived.  And he lives forever.
Listen Now!
","The Life of Jesus"
"1420","The Teachings of Jesus","In speaking to his disciples Jesus said, ""You call me Teacher and Lord and rightly so, for that is what I am"" (John 13:13).  But what did Jesus teach?  The lessons that follow are by no means an exhaustive treatment of the subjects about which Jesus spoke.  But it is a list of 16 important topics that Jesus explained and clarified to his followers.
Listen Now!
","The Teachings of Jesus"
"1430","Biblical Theology 101  ","""I Believe"" Series
The study of theology is the consideration of God and all that relates to Him.  The source of our information is the Bible, the uniquely inspired Word of God.  
This series, ""I Believe"", is not designed to be comprehensive or a technical work for professionals.  Rather it is intended for lay Christians, who desire to have a more systematic knowledge of and approach to Biblical truth.  
Hopefully, these lessons will whet the appetite of the student so that serious future study might be undertaken in an evangelical school of higher education or personally in evangelical theological books -or both.
Listen Now!
","Biblical Theology 101  "
"1440","Prophecy 101","Prophecy is eschatology or the study of the end times.  The subject of Bible prophecy is complicated and can be controversial.  There are various interpretations by good and competent persons.  I do not claim to be an authority in this area.  The late Dr. Bernard Ramm once said, ""Teach thy tongue to say, I do not know.""  That is a wise statement to be applied in many fields.  I would add a warning:  Don't trust anyone who claims to have the last word on prophecy.  When we come to this subject, we all need a humble heart and mind.  
Yet there are some future events in Holy Scripture that are not all that complicated.  Those are the things I wish to concentrate on.  Probably none of us is an expert on prophecy.  We are all life-long students of this subject.  If prophecy is new to you, the following lessons will be something of an introduction.  I hope you will enjoy the lessons and draw closer to Jesus Christ as a result. 
Listen Now!
","Prophecy 101"
"1450","Family Life 101","The life of the Christian family is of great concern to the believer.  We live in a time, in the Western World, when the family is in breakdown.  It is said that 50% of all marriages end in divorce.  Sometimes there are children involved.  They are greatly impacted.  Then comes the reconstituted family with his kids, her kids and our kids.  That has its challenges.  
Family Life 101 is not meant to cover all the bases or to take the place of professional counselors.  Rather this is supplemental material from the Word of God that will assist Christian families is structuring and maintaining wholesome family living in the 21st Century.
Listen Now!
","Family Life 101"
"1460","Discipleship 101","It is critically important that a new Christian learn to be a disciple, a disciplined one, a faithful follower of Jesus Christ.  If one has been ""born again"", now that person learns gradually to deal with the basic issues of the Christian life.  For sure, there is much more to grasp, but the nine lessons below will give one a good beginning.
Listen Now
","Discipleship 101"
"1465","Fruit of the Spirit","The ""Fruit of the Spirit"", based on Galations 5:22-23, is all about the Godly characteristics the Holy Spirit wants to grow inside each believer.  We all have these nine characteristics in us, but they have been severely damaged by sin.  Therefore, following our salvation the Holy Spirit takes up residence in us and begins the process of not only damage control, but also damage repair.  That's what these lessons are about - how the Holy Spirit works in our lives all through life to make us more like Jesus in nine important areas.
Listen Now!","Fruit of the Spirit "
"1466","Spiritual Disciplines 101","Spiritual Disciplines are practices that draw us near to God.  The disciplines themselves are not the objective.  What we want is to know God.  Through these disciplines we draw near to God and God draws near to us.
In six lessons we examine 12 different spiritual disciplines.  These are not things that we master all at once.  We must gradually learn these practices.  As they develop in our lives they vindicate themselves as valuable in our spiritual growth.
Pastor Art is indebted to Richard J. Foster and his book, Celebration of Discipline, for the concepts and much of the content of the lessons below.
Listen Now
","Spiritual Disciplines 101"
"1467","Growing in Christ","The apostle Peter wrote in his second letter, ""Grow in the grace and knowledge of our Lord and Savior Jesus Christ"" (2Peter 3:18).  Just the word ""grow"" implies our need for progress.  As Christians there is always new territory to claim.  
The areas in which we are to grow are grace and knowledge.  Grace is the help from God that we do not deserve but desperately need.  The area of growth is in the knowledge of our Savior and Lord, Jesus Christ.  There is always more to know about Jesus and the Bible is our source book.  Of course, the end result of experiencing more of the grace and knowledge of Jesus is to become more like him - and he is holy.
The 17 lessons in the Growing in Christ series are designed to move us from our new birth right on through important stages in the Christian life.  There is no claim here to be comprehensive.  However, there is much in these lessons to make each of us more Christ - like and therefore more to the praise of his glory.
Listen Now!","Growing in Christ"
"1468","Attributes of God","The study of the attributes (characteristics) of God is exciting.  It tells us what God is like and how he relates to us. 
Pastor Art has made use of source material in a series of studies by various authors on The Attributes of God appearing in Decision Magazine in the decade of the 1990s - a publication of the Billy Graham Evangelistic Association.  He also included his own Biblical information and experiences.  What emerged is an interesting set of merged lessons that will help a person understand the Triune God better and draw closer to Him. 
Listen Now!","Attributes of God"
"1469","Heart of God","What is God really interested in?  What moves his heart?  The following lessons tell you what is important to God.
Pastor Art has made use of source material in a series of studies by various authors on The Heart of God appearing in Decision Magazine in the decade of the 1990s - a publication of the Billy Graham Evangelistic Association.  He has also included his own Biblical information and experiences.  What emerged is an interesting set of merged lessons for which Pastor Art is alone responsible.  He is sure that the lessons will help a person understand the Triune God better and draw closer to Him.
Listen now!
","Heart of God"
"1470","Gifts of God","When we become Christians there begins a process of enrichment.  God gives us his good gifts over time.  No good gift will he withhold from us.  HE is a benevolent God.
Pastor Art has made use of source material in a series of studies by various authors on The Gifts of God appearing in Decision Magazine in the decade of the 1990s - a publication of the Billy Graham Evangelistic Association.  He also included his own Biblical information and experiences.  What emerged is an interesting set of merged lessons for which Pastor Art is alone responsible.  He is sure that the lessons will help a person understand the Triune God better and draw closer to Him.
Listen now!
","Gifts of God"
